{
  "cases": [
    {
      "away_team_id": "south-africa",
      "captured_at": "2026-06-09T23:27:23-03:00",
      "home_team_id": "mexico",
      "kickoff_at": "2026-06-11T19:00:00Z",
      "metadata": {
        "license": "CC0 1.0 Universal",
        "source": "OpenFootball worldcup.json",
        "source_match_number": 1,
        "source_url": "https://raw.githubusercontent.com/openfootball/worldcup.json/master/2026/worldcup.json"
      },
      "result": {
        "away": 0,
        "home": 2
      },
      "source_id": "openfootball-worldcup-2026-match-001"
    },
    {
      "away_team_id": "czechia",
      "captured_at": "2026-06-09T23:27:23-03:00",
      "home_team_id": "korea-republic",
      "kickoff_at": "2026-06-12T02:00:00Z",
      "metadata": {
        "license": "CC0 1.0 Universal",
        "source": "OpenFootball worldcup.json",
        "source_match_number": 2,
        "source_url": "https://raw.githubusercontent.com/openfootball/worldcup.json/master/2026/worldcup.json"
      },
      "result": {
        "away": 1,
        "home": 2
      },
      "source_id": "openfootball-worldcup-2026-match-002"
    },
    {
      "away_team_id": "bosnia-and-herzegovina",
      "captured_at": "2026-06-09T23:27:23-03:00",
      "home_team_id": "canada",
      "kickoff_at": "2026-06-12T19:00:00Z",
      "metadata": {
        "license": "CC0 1.0 Universal",
        "source": "OpenFootball worldcup.json",
        "source_match_number": 7,
        "source_url": "https://raw.githubusercontent.com/openfootball/worldcup.json/master/2026/worldcup.json"
      },
      "result": {
        "away": 1,
        "home": 1
      },
      "source_id": "openfootball-worldcup-2026-match-007"
    },
    {
      "away_team_id": "paraguay",
      "captured_at": "2026-06-09T23:27:23-03:00",
      "home_team_id": "usa",
      "kickoff_at": "2026-06-13T01:00:00Z",
      "metadata": {
        "license": "CC0 1.0 Universal",
        "source": "OpenFootball worldcup.json",
        "source_match_number": 19,
        "source_url": "https://raw.githubusercontent.com/openfootball/worldcup.json/master/2026/worldcup.json"
      },
      "result": {
        "away": 1,
        "home": 4
      },
      "source_id": "openfootball-worldcup-2026-match-019"
    },
    {
      "away_team_id": "scotland",
      "captured_at": "2026-06-09T23:27:23-03:00",
      "home_team_id": "haiti",
      "kickoff_at": "2026-06-14T01:00:00Z",
      "metadata": {
        "license": "CC0 1.0 Universal",
        "source": "OpenFootball worldcup.json",
        "source_match_number": 14,
        "source_url": "https://raw.githubusercontent.com/openfootball/worldcup.json/master/2026/worldcup.json"
      },
      "result": {
        "away": 1,
        "home": 0
      },
      "source_id": "openfootball-worldcup-2026-match-014"
    },
    {
      "away_team_id": "turkiye",
      "captured_at": "2026-06-09T23:27:23-03:00",
      "home_team_id": "australia",
      "kickoff_at": "2026-06-14T04:00:00Z",
      "metadata": {
        "license": "CC0 1.0 Universal",
        "source": "OpenFootball worldcup.json",
        "source_match_number": 20,
        "source_url": "https://raw.githubusercontent.com/openfootball/worldcup.json/master/2026/worldcup.json"
      },
      "result": {
        "away": 0,
        "home": 2
      },
      "source_id": "openfootball-worldcup-2026-match-020"
    },
    {
      "away_team_id": "morocco",
      "captured_at": "2026-06-09T23:27:23-03:00",
      "home_team_id": "brazil",
      "kickoff_at": "2026-06-13T22:00:00Z",
      "metadata": {
        "license": "CC0 1.0 Universal",
        "source": "OpenFootball worldcup.json",
        "source_match_number": 13,
        "source_url": "https://raw.githubusercontent.com/openfootball/worldcup.json/master/2026/worldcup.json"
      },
      "result": {
        "away": 1,
        "home": 1
      },
      "source_id": "openfootball-worldcup-2026-match-013"
    },
    {
      "away_team_id": "switzerland",
      "captured_at": "2026-06-09T23:27:23-03:00",
      "home_team_id": "qatar",
      "kickoff_at": "2026-06-13T19:00:00Z",
      "metadata": {
        "license": "CC0 1.0 Universal",
        "source": "OpenFootball worldcup.json",
        "source_match_number": 8,
        "source_url": "https://raw.githubusercontent.com/openfootball/worldcup.json/master/2026/worldcup.json"
      },
      "result": {
        "away": 1,
        "home": 1
      },
      "source_id": "openfootball-worldcup-2026-match-008"
    },
    {
      "away_team_id": "ecuador",
      "captured_at": "2026-06-09T23:27:23-03:00",
      "home_team_id": "cote-d-ivoire",
      "kickoff_at": "2026-06-14T23:00:00Z",
      "metadata": {
        "license": "CC0 1.0 Universal",
        "source": "OpenFootball worldcup.json",
        "source_match_number": 26,
        "source_url": "https://raw.githubusercontent.com/openfootball/worldcup.json/master/2026/worldcup.json"
      },
      "result": {
        "away": 0,
        "home": 1
      },
      "source_id": "openfootball-worldcup-2026-match-026"
    },
    {
      "away_team_id": "curacao",
      "captured_at": "2026-06-09T23:27:23-03:00",
      "home_team_id": "germany",
      "kickoff_at": "2026-06-14T17:00:00Z",
      "metadata": {
        "license": "CC0 1.0 Universal",
        "source": "OpenFootball worldcup.json",
        "source_match_number": 25,
        "source_url": "https://raw.githubusercontent.com/openfootball/worldcup.json/master/2026/worldcup.json"
      },
      "result": {
        "away": 1,
        "home": 7
      },
      "source_id": "openfootball-worldcup-2026-match-025"
    },
    {
      "away_team_id": "japan",
      "captured_at": "2026-06-09T23:27:23-03:00",
      "home_team_id": "netherlands",
      "kickoff_at": "2026-06-14T20:00:00Z",
      "metadata": {
        "license": "CC0 1.0 Universal",
        "source": "OpenFootball worldcup.json",
        "source_match_number": 31,
        "source_url": "https://raw.githubusercontent.com/openfootball/worldcup.json/master/2026/worldcup.json"
      },
      "result": {
        "away": 2,
        "home": 2
      },
      "source_id": "openfootball-worldcup-2026-match-031"
    },
    {
      "away_team_id": "tunisia",
      "captured_at": "2026-06-09T23:27:23-03:00",
      "home_team_id": "sweden",
      "kickoff_at": "2026-06-15T02:00:00Z",
      "metadata": {
        "license": "CC0 1.0 Universal",
        "source": "OpenFootball worldcup.json",
        "source_match_number": 32,
        "source_url": "https://raw.githubusercontent.com/openfootball/worldcup.json/master/2026/worldcup.json"
      },
      "result": {
        "away": 1,
        "home": 5
      },
      "source_id": "openfootball-worldcup-2026-match-032"
    },
    {
      "away_team_id": "uruguay",
      "captured_at": "2026-06-09T23:27:23-03:00",
      "home_team_id": "saudi-arabia",
      "kickoff_at": "2026-06-15T22:00:00Z",
      "metadata": {
        "license": "CC0 1.0 Universal",
        "source": "OpenFootball worldcup.json",
        "source_match_number": 44,
        "source_url": "https://raw.githubusercontent.com/openfootball/worldcup.json/master/2026/worldcup.json"
      },
      "result": {
        "away": 1,
        "home": 1
      },
      "source_id": "openfootball-worldcup-2026-match-044"
    },
    {
      "away_team_id": "cabo-verde",
      "captured_at": "2026-06-09T23:27:23-03:00",
      "home_team_id": "spain",
      "kickoff_at": "2026-06-15T16:00:00Z",
      "metadata": {
        "license": "CC0 1.0 Universal",
        "source": "OpenFootball worldcup.json",
        "source_match_number": 43,
        "source_url": "https://raw.githubusercontent.com/openfootball/worldcup.json/master/2026/worldcup.json"
      },
      "result": {
        "away": 0,
        "home": 0
      },
      "source_id": "openfootball-worldcup-2026-match-043"
    },
    {
      "away_team_id": "new-zealand",
      "captured_at": "2026-06-09T23:27:23-03:00",
      "home_team_id": "ir-iran",
      "kickoff_at": "2026-06-16T01:00:00Z",
      "metadata": {
        "license": "CC0 1.0 Universal",
        "source": "OpenFootball worldcup.json",
        "source_match_number": 38,
        "source_url": "https://raw.githubusercontent.com/openfootball/worldcup.json/master/2026/worldcup.json"
      },
      "result": {
        "away": 2,
        "home": 2
      },
      "source_id": "openfootball-worldcup-2026-match-038"
    },
    {
      "away_team_id": "egypt",
      "captured_at": "2026-06-09T23:27:23-03:00",
      "home_team_id": "belgium",
      "kickoff_at": "2026-06-15T19:00:00Z",
      "metadata": {
        "license": "CC0 1.0 Universal",
        "source": "OpenFootball worldcup.json",
        "source_match_number": 37,
        "source_url": "https://raw.githubusercontent.com/openfootball/worldcup.json/master/2026/worldcup.json"
      },
      "result": {
        "away": 1,
        "home": 1
      },
      "source_id": "openfootball-worldcup-2026-match-037"
    },
    {
      "away_team_id": "senegal",
      "captured_at": "2026-06-09T23:27:23-03:00",
      "home_team_id": "france",
      "kickoff_at": "2026-06-16T19:00:00Z",
      "metadata": {
        "license": "CC0 1.0 Universal",
        "source": "OpenFootball worldcup.json",
        "source_match_number": 49,
        "source_url": "https://raw.githubusercontent.com/openfootball/worldcup.json/master/2026/worldcup.json"
      },
      "result": {
        "away": 1,
        "home": 3
      },
      "source_id": "openfootball-worldcup-2026-match-049"
    },
    {
      "away_team_id": "norway",
      "captured_at": "2026-06-09T23:27:23-03:00",
      "home_team_id": "iraq",
      "kickoff_at": "2026-06-16T22:00:00Z",
      "metadata": {
        "license": "CC0 1.0 Universal",
        "source": "OpenFootball worldcup.json",
        "source_match_number": 50,
        "source_url": "https://raw.githubusercontent.com/openfootball/worldcup.json/master/2026/worldcup.json"
      },
      "result": {
        "away": 4,